{
  "slug": "settings-prompt",
  "targetRoutes": [
    {
      "route": "/settings",
      "purpose": "Verify the implemented prompt editor in its actual settings page context.",
      "authState": "authenticated team admin, if the app requires auth",
      "dataState": "existing saved prompt or explicitly marked placeholder"
    }
  ],
  "viewports": [
    {
      "name": "desktop",
      "width": 1440,
      "height": 1000
    },
    {
      "name": "mobile",
      "width": 390,
      "height": 844
    }
  ],
  "states": [
    {
      "name": "default",
      "setup": "Open /settings with prompt editor visible.",
      "expected": "Editor is primary, templates and preview are secondary, placeholder content is labeled if used.",
      "blockingLevel": "P1"
    },
    {
      "name": "error",
      "setup": "Trigger validation with prompt content below the app's minimum valid threshold.",
      "expected": "Error appears near editor, remains accessible, and does not shift the whole layout unexpectedly.",
      "blockingLevel": "P1"
    },
    {
      "name": "success",
      "setup": "Save a valid prompt using existing app behavior.",
      "expected": "Saved state confirms scope without inventing downstream side effects.",
      "blockingLevel": "P2"
    }
  ],
  "interactions": [
    {
      "name": "keyboard-path",
      "steps": [
        "Tab to textarea",
        "Tab to primary action",
        "Trigger validation or save"
      ],
      "expected": "Focus-visible is clear and every visible action is reachable.",
      "blockingLevel": "P1"
    },
    {
      "name": "long-text",
      "steps": [
        "Paste a long prompt",
        "Resize or scroll editor",
        "Check adjacent panels"
      ],
      "expected": "Text does not overflow parent controls or occlude adjacent content.",
      "blockingLevel": "P2"
    }
  ],
  "referenceScreenshots": [
    {
      "artifact": "fixtures/docs-design-sample/settings-prompt/option-b.html",
      "description": "已选设计的主要构图参考",
      "viewport": "desktop",
      "state": "default"
    },
    {
      "artifact": "fixtures/docs-design-sample/settings-prompt/option-c.html",
      "description": "显性错误状态处理参考",
      "viewport": "desktop",
      "state": "error"
    }
  ],
  "checks": [
    {
      "id": "QA-001",
      "category": "contract",
      "description": "实现遵守已选 B+A+C 决策，以及必须保留、允许改变、必须避免清单。",
      "blockingLevel": "P1"
    },
    {
      "id": "QA-002",
      "category": "font",
      "description": "Font family, weight, size, line-height, fallback, wrapping, and truncation match DESIGN.md or project tokens.",
      "blockingLevel": "P2"
    },
    {
      "id": "QA-003",
      "category": "spacing",
      "description": "Editor, rail, preview, actions, and status spacing match selected density without overlap.",
      "blockingLevel": "P2"
    },
    {
      "id": "QA-004",
      "category": "color",
      "description": "Colors map to DESIGN.md or project tokens, with no drifted state color or low contrast.",
      "blockingLevel": "P2"
    },
    {
      "id": "QA-005",
      "category": "content",
      "description": "No invented data, lorem, filler copy, or fake controls.",
      "blockingLevel": "P1"
    },
    {
      "id": "QA-006",
      "category": "interaction",
      "description": "Validate/save, focus-visible, long text, error, success, and mobile interactions work.",
      "blockingLevel": "P1"
    },
    {
      "id": "QA-007",
      "category": "ai-shortcut",
      "description": "No rounded-card plus colored-left-border emphasis, decorative blobs, placeholder imagery, or repeated icon card grid.",
      "blockingLevel": "P2"
    },
    {
      "id": "design-system-1",
      "category": "contract",
      "description": "实现沿用 DESIGN.md 的 restrained 产品 UI、现有输入控件、按钮、面板、分隔、语义状态 token、焦点和可访问性规则。",
      "blockingLevel": "P1"
    },
    {
      "id": "self-review-1",
      "category": "contract",
      "description": "未新增 DESIGN.md 之外的颜色、圆角、阴影或字体。",
      "blockingLevel": "P2"
    },
    {
      "id": "self-review-2",
      "category": "contract",
      "description": "未改变设置导航、提交逻辑和组件 API。",
      "blockingLevel": "P2"
    },
    {
      "id": "self-review-3",
      "category": "contract",
      "description": "小屏折叠后输入区仍是第一优先且无文字溢出。",
      "blockingLevel": "P2"
    },
    {
      "id": "self-review-4",
      "category": "contract",
      "description": "错误、成功、加载状态均有可访问文本和焦点反馈。",
      "blockingLevel": "P2"
    }
  ],
  "blockers": [
    "Cannot open /settings or equivalent component preview.",
    "无法捕获目标界面的视觉证据。",
    "Missing design-contract.json, implementation-handoff.md, or qa-plan.json.",
    "当前实现目标与已确认目标界面不一致。"
  ],
  "impeccable": {
    "detect": {
      "enabled": true,
      "targets": ["/settings"],
      "notes": "Use the implemented route or actual implementation source files for this contract; do not scan workbench or option HTML."
    },
    "critique": {
      "enabled": false,
      "notes": "需要额外设计评审时启用；critique 不能替代设计契约验收。"
    }
  },
  "reports": {
    "qaReport": "fixtures/docs-design-sample/settings-prompt/qa-report.md",
    "evidenceDir": "fixtures/docs-design-sample/settings-prompt/evidence"
  }
}
